{
  "schema_version": 1,
  "product": "Pi Coding Harness",
  "version": "1.3.0",
  "authority_schema": 35,
  "status": "VERIFYING",
  "state_generation": 105,
  "current_phase": "P13",
  "current_stage": "SINGLE_CODE_VERIFIED_PERFORMANCE_OPEN",
  "updated_at": "2026-10-10T04:45:38.1553738-07:00",
  "goal": "Complete the supported Single edition of PCH: remove Multi execution, preserve historical authority, reduce unnecessary control overhead and verify the real Single lifecycle before updating GitHub. No GitHub Release is authorized for this delivery.",
  "completed_receipts": [
    {
      "id": "PCH-REC-CODE-BASELINE",
      "result": "PASS",
      "evidence": "Current source compiled and linted; 65 test files and 363 tests passed with 5 conditional skips after control/context negative tests were added."
    },
    {
      "id": "PCH-REC-DESIGN-AUDIT",
      "result": "PASS",
      "evidence": "Every active capability was rechecked and the final decisions are recorded as PCH-AUD-001 through PCH-AUD-020 in the sole blueprint."
    },
    {
      "id": "PCH-REC-SCHEMA-GATE",
      "result": "PASS",
      "evidence": "48 Draft 2020-12 schemas compiled strictly and 22 project instances validated; migration coverage, byte counts and SHA-256 were checked."
    },
    {
      "id": "PCH-REC-MEMORY-CORPUS",
      "result": "PASS",
      "evidence": "The frozen zh-CN Memory capture corpus expanded to 1,225 unique cases and passed with zero disallowed ACTIVE captures."
    },
    {
      "id": "PCH-REC-RELEASE-GATE",
      "result": "PASS",
      "evidence": "All 13 clean-root release steps passed in 124850 ms; 363 tests passed and 5 environment-gated tests skipped."
    },
    {
      "id": "PCH-REC-MIGRATION",
      "result": "PASS",
      "evidence": "357 migration dispositions and 349 target hashes produced a 352-file self-contained release with zero hash mismatch, forbidden file or reparse point."
    },
    {
      "id": "PCH-REC-LIVE-INSTALL",
      "result": "PASS",
      "evidence": "Pi 0.82.1 installed X:\\Pi Coding Harness, doctor passed from an unrelated cwd, and pi list showed only the new Harness path."
    },
    {
      "id": "PCH-REC-GIT-SURFACE",
      "result": "PASS",
      "evidence": "Root-anchored ignore rules preserve all three src/artifacts files while excluding root runtime/dependency/report trees; affected state, JSON and self-contained gates passed."
    },
    {
      "id": "PCH-REC-CACHE-C1-ACTIVATION",
      "result": "PASS",
      "evidence": "Cache C1 is enabled only for the exact geekspace/openai-completions/base-URL contract; frozen membership contains 200 responses across 11 sessions, 138 positive cacheRead reports and 20,424,704 cache-read tokens. Normalized zero remains UNOBSERVABLE and unsupported runtimes fall back to C0."
    },
    {
      "id": "PCH-REC-PERFORMANCE-1.1.0",
      "result": "PASS",
      "evidence": "Four local performance suites passed with zero extra model/provider requests. Lease renewal was removed from the per-mutation hot path while every authority transaction retains lease and fencing validation."
    },
    {
      "id": "PCH-REC-RELEASE-1.1.0",
      "result": "PASS",
      "evidence": "All 13 release steps passed in 134,992 ms; 375 tests passed and 6 environment-gated tests skipped; 363 migration dispositions and 355 source hashes produced zero self-contained mismatches."
    },
    {
      "id": "PCH-REC-LIVE-INSTALL-1.1.0",
      "result": "PASS",
      "evidence": "Pi 0.82.1 installed X:\\Pi Coding Harness; doctor and unrelated-cwd local command probes passed; pi list contains only the new package name and path."
    },
    {
      "id": "PCH-REC-ACYCLIC-RELEASE-1.1.0",
      "result": "PASS",
      "evidence": "All 13 release steps passed in 118,575 ms; 376 tests passed and 6 environment-gated tests skipped; 364 migration dispositions and 356 source hashes validate with zero self-contained mismatches; live install, doctor and unrelated-cwd command probes passed."
    },
    {
      "id": "PCH-REC-SMOKE-PRD01-003",
      "result": "PASS",
      "evidence": "Hidden quality passed 26/26 and PCH authority closed with integrity ok; the 1,400,746 ms, 80-request run was audited in RUN-REVIEW.md with SHA-256 58958057134388D0054734D58FC9DF2C710483AE0B52C1CBC1343CB638134D7D."
    },
    {
      "id": "PCH-REC-FORMAL-003",
      "result": "FAIL",
      "evidence": "The single post-compaction formal run completed all eight frozen tasks in 3,075,533 ms with 6/8 hidden quality, 4,534,239 total tokens, 144 provider requests and 91.99% token-weighted cache read share; its raw score is immutable. BENCHMARK-REPORT.json SHA-256 is 87BEDAA5BF0A725BA4362EAC3BD364AE9E1B480E7EBCE416C1AC170FAF0A1C7F."
    },
    {
      "id": "PCH-REC-FORMAL-003-OVERHEAD",
      "result": "PASS",
      "evidence": "The post-run audit counted 251 tool calls, 24 flow calls, 7 rejected flow calls, 4 status-only calls, 6 environment probes and 14 adjacent duplicate Widget updates. Only evidence-backed redundancy was removed; changed-source rereads and fresh post-mutation validations remain correctness work. Audit SHA-256 is 129464FAB7C6F937D02FDF23416E6387B495BE9AC729E1B904415DDEB3E50BDB."
    },
    {
      "id": "PCH-REC-POST-FORMAL-REMEDIATION",
      "result": "PASS",
      "evidence": "Admission classification, PRD routing, acceptance-facet minimums, mutation-required closure, route repair, proposal guidance, transition-status reuse and Widget deduplication have deterministic regressions. The bounded-worker release verifier passed 399 tests with 6 conditional skips and zero failures in 125,083 ms without model/provider requests."
    },
    {
      "id": "PCH-REC-RELEASE-1.2.0",
      "result": "PASS",
      "evidence": "All 13 release steps passed in 118,065 ms; 423 tests passed with 6 conditional skips; SQL 001-019, JSON, Markdown, performance, lifecycle, arbitrary-cwd import and self-contained checks passed with zero model/provider requests."
    },
    {
      "id": "PCH-REC-LIVE-UPGRADE-1.2.0",
      "result": "PASS",
      "evidence": "Pi local package registration was refreshed to X:\\Pi Coding Harness; doctor passed at authority schema 19 and pi list from an unrelated cwd showed one Harness registration."
    },
    {
      "id": "PCH-REC-RELEASE-1.2.1",
      "result": "PASS",
      "evidence": "All 13 release steps passed in 132,520 ms; 426 tests passed with 6 conditional skips; performance, compile, lint, build, SQL, JSON, Markdown, state, lifecycle, arbitrary-cwd import and self-contained checks passed with zero model/provider requests."
    },
    {
      "id": "PCH-REC-LIVE-UPGRADE-1.2.1",
      "result": "PASS",
      "evidence": "Pi local package registration was refreshed to X:\\Pi Coding Harness; doctor passed at authority schema 19 with no lifecycle failures."
    },
    {
      "id": "PCH-REC-SMOKE-PRD01-006-DIAGNOSTIC",
      "result": "FAIL",
      "evidence": "Fail-fast stopped the run after 69,048 ms at the first PCH_STALE_CONTROL_FRAME; one Contract transition succeeded, one Route transition was rejected, no repository files changed, and the run is diagnostic-only."
    },
    {
      "id": "PCH-REC-ACTIVE-RUN-LEASE-HEARTBEAT",
      "result": "PASS",
      "evidence": "A local Host heartbeat preserves the same lease generation and fencing token throughout an active Agent run and stops at generation_settled/close/failure. The 45-second virtual-clock regression and 27 focused Host/Bridge tests passed without an extra model/provider request."
    },
    {
      "id": "PCH-REC-SMOKE-PRD01-008-DIAGNOSTIC",
      "result": "FAIL",
      "evidence": "Diagnostic-only SINGLE run pch-smoke-prd01-008 exercised the heartbeat for about 23 minutes with zero stale ControlFrame, froze Contract and Route revisions, then fail-fast stopped at the second equivalent unsupported-oracle rejection. It is not scoring eligible and must not be resumed."
    },
    {
      "id": "PCH-REC-ORACLE-POLICY-REMEDIATION",
      "result": "PASS",
      "evidence": "Oracle classification now identifies shell composition, npm exec, long-running modes and unsupported commands separately; rejection text includes the bounded offending command and explains that commands[] does not widen the allowlist. Terminating local esbuild/microbundle commands are accepted, npm exec and out-of-workspace build outputs remain denied. Two focused unit files passed 21 tests, Host/Bridge passed 27 tests, compile/lint/build:runtime passed."
    },
    {
      "id": "PCH-REC-STRESS-CONTROLLER-QUALIFICATION",
      "result": "PASS",
      "evidence": "No-model qualification prepared a clean remote-free Terraform workspace at the frozen fixture tree and verified Go 1.22.5; evaluator self-test extracted 8 production changes and passed all 35 frozen tests with zero JSON parse errors. Stress manifest SHA-256 B97C1EE6CCE60A0940D6593578037D9090C7C8DE60E10475362371DE5BC0474D; qualification hashes 0F8D640B87C812178C26993A4CF433C3FF5002AA90324E8E92F423E6A8AB720D and 6A21675E80E8E8B6C7141C2D06F2512A692B66981A6704AFF5B2E1222B8EB56C."
    },
    {
      "id": "PCH-REC-PRD01-FINAL-CONTROLLER-QUALIFICATION",
      "result": "PASS",
      "evidence": "No-model prepare-only qualification passed for PRD-01 with the current PCH candidate source, clean remote-free fixture and frozen isolation controls. Full benchmark manifest SHA-256 2A88DA799F3A7D89981F8E0FFFF70E52EB1941AD1CA20F560FC49B619F4CCB1B; qualification SHA-256 64B885301925FAC9DC95640C9CB09B72BA37ABC61554DCA87A152E9C4FE7CA4E."
    },
    {
      "id": "PCH-REC-STRESS-ROUTE-CONTRACT-QUALIFICATION",
      "result": "PASS",